{
  "name": "fx-lab",
  "version": "0.1.0",
  "homepage": "https://rosuh.me/fx-lab/",
  "sections": [
    {
      "id": "generative",
      "name": "Generative",
      "nameLocal": "生成"
    },
    {
      "id": "post-and-print",
      "name": "Post & Print",
      "nameLocal": "后处理·印刷"
    },
    {
      "id": "world-patterns",
      "name": "World Patterns",
      "nameLocal": "世界纹样"
    },
    {
      "id": "design-movements",
      "name": "Design Movements",
      "nameLocal": "设计流派"
    },
    {
      "id": "data-and-system",
      "name": "Data & System",
      "nameLocal": "数据·系统"
    },
    {
      "id": "interaction",
      "name": "Interaction",
      "nameLocal": "交互"
    },
    {
      "id": "geometry-and-curves",
      "name": "Geometry & Curves",
      "nameLocal": "几何·曲线"
    },
    {
      "id": "fractal-and-chaos",
      "name": "Fractal & Chaos",
      "nameLocal": "分形·混沌"
    },
    {
      "id": "cellular-and-physics",
      "name": "Cellular & Physics",
      "nameLocal": "元胞·物理"
    },
    {
      "id": "world-patterns-ii",
      "name": "World Patterns II",
      "nameLocal": "世界纹样 II"
    },
    {
      "id": "screen-and-signal",
      "name": "Screen & Signal",
      "nameLocal": "屏幕·信号"
    },
    {
      "id": "interaction-and-generative",
      "name": "Interaction & Generative II",
      "nameLocal": "交互·生成 II"
    }
  ],
  "effects": [
    {
      "id": "gradient",
      "kind": "shader",
      "name": "Gradient Flow",
      "nameLocal": null,
      "section": "generative",
      "summary": "Silky domain-warped color field in deep blue, purple and teal; slow hypnotic drift.",
      "description": "Layered FBM domain-warp generates a continuously morphing gradient across the frame. Mouse position subtly shifts the warp anchor, making the color field breathe toward the cursor. Ideal as a calm animated background behind text or UI.",
      "descriptionZh": "域扭曲 FBM · 跟随光标",
      "tags": [
        "noise",
        "flow",
        "plasma",
        "glow",
        "webgl2",
        "background"
      ],
      "vibe": [
        "calm",
        "ambient",
        "meditative"
      ],
      "culture": null,
      "accuracyNote": null,
      "perf": {
        "gpu": "med",
        "cpu": "low",
        "mobileSafe": true
      },
      "interactive": {
        "followsCursor": true,
        "trigger": "hover"
      },
      "reducedMotion": "freeze",
      "deterministic": true,
      "state": null,
      "license": "MIT",
      "attribution": null,
      "url": "https://rosuh.me/fx-lab/effects/gradient.md",
      "preview": null
    },
    {
      "id": "dots",
      "kind": "shader",
      "name": "Dot-Matrix Wave",
      "nameLocal": null,
      "section": "generative",
      "summary": "Blue-teal dot grid pulses in rolling waves; cursor pushes dots outward in a satisfying bulge.",
      "description": "A 24×24 grid of round dots ripples with a traveling sine wave keyed to each cell's distance from the origin. Moving the cursor creates a localized bulge that expands nearby dots. Works as a subtle animated overlay or panel background.",
      "descriptionZh": "点阵波动 + 光标隆起",
      "tags": [
        "dots",
        "grid",
        "waves",
        "noise",
        "webgl2",
        "background"
      ],
      "vibe": [
        "calm",
        "playful",
        "geometric"
      ],
      "culture": null,
      "accuracyNote": null,
      "perf": {
        "gpu": "med",
        "cpu": "low",
        "mobileSafe": true
      },
      "interactive": {
        "followsCursor": true,
        "trigger": "hover"
      },
      "reducedMotion": "freeze",
      "deterministic": true,
      "state": null,
      "license": "MIT",
      "attribution": null,
      "url": "https://rosuh.me/fx-lab/effects/dots.md",
      "preview": null
    },
    {
      "id": "metaballs",
      "kind": "shader",
      "name": "Metaballs",
      "nameLocal": null,
      "section": "generative",
      "summary": "Five glowing purple-magenta blobs orbit and merge organically; cursor draws in a sixth.",
      "description": "Five metaballs travel sine-path orbits and merge via a smooth potential-field threshold. The cursor injects a sixth ball, pulling the fluid mass toward the pointer. Good for psychedelic loading states or dark hero backgrounds.",
      "descriptionZh": "有机融合光球",
      "tags": [
        "metaballs",
        "plasma",
        "glow",
        "fluid",
        "webgl2",
        "background"
      ],
      "vibe": [
        "hypnotic",
        "psychedelic",
        "organic"
      ],
      "culture": null,
      "accuracyNote": null,
      "perf": {
        "gpu": "med",
        "cpu": "low",
        "mobileSafe": true
      },
      "interactive": {
        "followsCursor": true,
        "trigger": "hover"
      },
      "reducedMotion": "freeze",
      "deterministic": true,
      "state": null,
      "license": "MIT",
      "attribution": null,
      "url": "https://rosuh.me/fx-lab/effects/metaballs.md",
      "preview": null
    },
    {
      "id": "aurora",
      "kind": "shader",
      "name": "Aurora Ribbons",
      "nameLocal": null,
      "section": "generative",
      "summary": "Shimmering green-and-purple aurora curtains stream down a starry night sky; serene fullscreen background.",
      "description": "Three fbm-driven aurora curtains with vertical rays sway over a faint starfield, fading into a horizon glow and cycling through green-to-purple hues on a near-black sky. The cursor's vertical position nudges the curtains. Slow and meditative; ideal as a dark-mode hero background.",
      "descriptionZh": "极光丝带",
      "tags": [
        "aurora",
        "waves",
        "glow",
        "noise",
        "webgl2",
        "background"
      ],
      "vibe": [
        "calm",
        "meditative",
        "ambient"
      ],
      "culture": null,
      "accuracyNote": null,
      "perf": {
        "gpu": "med",
        "cpu": "low",
        "mobileSafe": true
      },
      "interactive": {
        "followsCursor": true,
        "trigger": "hover"
      },
      "reducedMotion": "freeze",
      "deterministic": true,
      "state": null,
      "license": "MIT",
      "attribution": null,
      "url": "https://rosuh.me/fx-lab/effects/aurora.md",
      "preview": null
    },
    {
      "id": "ripple",
      "kind": "shader",
      "name": "Ripple Grid",
      "nameLocal": null,
      "section": "generative",
      "summary": "Teal grid lines bend under expanding ripple rings that emanate from the cursor.",
      "description": "An 18×18 cell grid is distorted by a sine ripple that decays exponentially away from the mouse pointer. Far cells remain crisp while near cells warp dramatically. Use as an interactive background for demos or landing pages.",
      "descriptionZh": "光标涟漪位移",
      "tags": [
        "ripple",
        "grid",
        "waves",
        "noise",
        "webgl2",
        "background"
      ],
      "vibe": [
        "hypnotic",
        "technical",
        "geometric"
      ],
      "culture": null,
      "accuracyNote": null,
      "perf": {
        "gpu": "med",
        "cpu": "low",
        "mobileSafe": true
      },
      "interactive": {
        "followsCursor": true,
        "trigger": "hover"
      },
      "reducedMotion": "freeze",
      "deterministic": true,
      "state": null,
      "license": "MIT",
      "attribution": null,
      "url": "https://rosuh.me/fx-lab/effects/ripple.md",
      "preview": null
    },
    {
      "id": "voronoi",
      "kind": "shader",
      "name": "Voronoi Cells",
      "nameLocal": null,
      "section": "generative",
      "summary": "Animated colour-cell mosaic with drifting seeds in jewel tones; organic and hypnotic.",
      "description": "A Voronoi partition whose seed points travel sine-path orbits, making cells grow and shrink continuously. Each cell's colour is derived from its hashed seed. Fits as a bold geometric background or section divider.",
      "descriptionZh": "细胞晶格 · 自然分形",
      "tags": [
        "voronoi",
        "cellular",
        "geometry",
        "noise",
        "webgl2",
        "background"
      ],
      "vibe": [
        "hypnotic",
        "organic",
        "geometric"
      ],
      "culture": null,
      "accuracyNote": null,
      "perf": {
        "gpu": "med",
        "cpu": "low",
        "mobileSafe": true
      },
      "interactive": {
        "followsCursor": false,
        "trigger": "auto"
      },
      "reducedMotion": "freeze",
      "deterministic": true,
      "state": null,
      "license": "MIT",
      "attribution": null,
      "url": "https://rosuh.me/fx-lab/effects/voronoi.md",
      "preview": null
    },
    {
      "id": "truchet",
      "kind": "shader",
      "name": "Truchet Tiles",
      "nameLocal": null,
      "section": "generative",
      "summary": "Scrolling arc-tile maze in dark teal; endlessly generative, calm, low-contrast texture.",
      "description": "Each tile is randomly assigned one of two Truchet arc orientations, producing a connected maze-like pattern. The pattern scrolls horizontally over time. A calm, low-contrast texture for backgrounds or overlays.",
      "descriptionZh": "程序化迷宫纹",
      "tags": [
        "tiling",
        "geometry",
        "lines",
        "webgl2",
        "background"
      ],
      "vibe": [
        "calm",
        "geometric",
        "meditative"
      ],
      "culture": null,
      "accuracyNote": null,
      "perf": {
        "gpu": "med",
        "cpu": "low",
        "mobileSafe": true
      },
      "interactive": {
        "followsCursor": false,
        "trigger": "auto"
      },
      "reducedMotion": "freeze",
      "deterministic": true,
      "state": null,
      "license": "MIT",
      "attribution": null,
      "url": "https://rosuh.me/fx-lab/effects/truchet.md",
      "preview": null
    },
    {
      "id": "kaleido",
      "kind": "shader",
      "name": "Kaleidoscope",
      "nameLocal": null,